Planet,Star,Star Count,Planet Count,Orbit Time (days),Planet Size (Earths),Planet Mass (Earths),Planet Density,Orbit Shape,habitability_score,Planet Temp (C),Information,description_english,description_spanish,description_french,description_german,description_hindi,description_japanese
HIP 116454 b,HIP 116454,2,1,9.1004157,2.469,9.7,3.53,0.215,0.4536191614039544,479.85,"Planet: HIP 116454 b, Star: HIP 116454, Star Count: 2, Planet Count: 1, Orbit Time (days): 9.1004157, Planet Size (Earths): 2.469, Planet Mass (Earths): 9.7, Planet Temp (C): 479.85, Planet Density: 3.53, Orbit Shape: 0.215","Hey there, young space explorer! Meet HIP 116454 b, a pretty cool planet that's about 2.5 times bigger and heavier than Earth. This hot world orbits its star in just over 9 days, which is really fast - it's like if the Sun were right next to you!","¡Hola, joven explorador del espacio! Conócele a HIP 116454 b, un planeta bastante impresionante que es casi tres veces más grande y pesado que la Tierra. Este mundo caliente gira en torno de su estrella en menos de 9 días, lo cual es muy rápido - ¡es como si el Sol estuviera justo al lado!","Salut jeune explorateur spatial ! Découvrez HIP 116454 b, un monde tout à fait sympa qui est environ 2,5 fois plus gros et lourd que la Terre. Cet astre brûlant orbite autour de sa étoile en moins de 9 jours, ce qui est très rapide - c'est comme si le Soleil était juste à côté de vous !","Hallo, junger Weltraum-Abenteurer! Entdecke HIP 116454 b, einen richtig coolen Planeten, der etwa 2,5 mal so groß und schwer ist wie die Erde. Dieser heiße Riese umkreist seine Sonne in nur knapp über 9 Tagen, was wirklich schnell ist - es wäre, als ob die Sonne direkt neben dir stünde!","युवा अंतरिक्ष खोजको, यहाँ हिप 116454 बी को जानिए। ये ग्रह पृथ्वी से करीब 2.5 गुना बड़ा और भारी है। इस ग्रह की अपने तारे के चारों ओर परिक्रमा करीब 9 दिनों में होती है, जो बहुत तेज है - यह ऐसा होगा अगर सूर्य आपके निकट हो!",キミは宇宙探険家か！HIP 116454 bと言う惑星がいます。それは地球より2.5倍大きく重いです。この熱い惑星は、約9日で星に回ります。これは、太陽があなたの横にあったように速いです。
HATS-17 b,HATS-17,1,1,16.254611,8.709,425.25654,3.5,0.029,0.4702297308964265,540.85,"Planet: HATS-17 b, Star: HATS-17, Star Count: 1, Planet Count: 1, Orbit Time (days): 16.254611, Planet Size (Earths): 8.709, Planet Mass (Earths): 425.25654, Planet Temp (C): 540.85, Planet Density: 3.5, Orbit Shape: 0.029","Hey there! Let's talk about HATS-17 b, a super cool planet that orbits a star called HATS-17. This giant world is about 8 times bigger than Earth and has a mass of 425 times more, making it a real behemoth - but don't worry, it's not hot enough to melt you!","Hola! Vamos a hablar sobre HATS-17 b, un planeta supercool que órbita una estrella llamada HATS-17. Este mundo gigante es aproximadamente ocho veces más grande que la Tierra y tiene una masa de 425 veces mayor, lo que lo convierte en un verdadero gigante - pero no te preocupes, no está caliente suficiente como para fundirte!","Salut ! Parlons de HATS-17 b, une planète super cool qui orbite autour d'une étoile appelée HATS-17. Ce monde géant fait 8 fois le tour du Terre et pèse 425 fois plus lourd, ce qui en fait un véritable géant - mais ne vous inquiétez pas, elle n'est pas suffisamment chaude pour fondre !","Hallo! Lassen Sie uns über HATS-17 b sprechen, einen wirklich coolen Planeten, der um eine Sonne namens HATS-17 kreist. Dieser Riese ist etwa 8-mal größer als die Erde und wiegt 425 Mal mehr, also ist es ein richtiger Riese – aber keine Sorge, es ist nicht heiß genug, dich zu schmelzen!","बातें करने की समय आ गई है! HATS-17 बी, एक अद्भुत ग्रह के बारे में, जो एक तारा HATS-17 के आसपास घूमता है। यह विशाल दुनिया, पृथ्वी से लगभग 8 गुना बड़ा और इसका massa पृथ्वी के 425 गुना अधिक, इसलिए वास्तव में एक बहुत बड़ा आत्मा है - लेकिन चिंता मत करो, यह इतना गर्म नहीं होगा कि तुम्हारी तरल कर देगा!","Konnichiwa! HATS-17 b to kangaeru ze! Kono supā kūru planet wa, seita no HATS-17 ni mawashite aru. Kōtei sekai no 8-gurai ōki na sekai de, massu wa 425-bara chikaku ni aru, sōda de ganbareru tsuyoi sekai da! Dake, atsui node naku ha, mirenu hodo tsukamu made wa atta koto wa nashi."
TOI-1260 c,TOI-1260,1,3,7.493134,2.76,13.2,3.45,0.0,0.4475582503051352,377.85,"Planet: TOI-1260 c, Star: TOI-1260, Star Count: 1, Planet Count: 3, Orbit Time (days): 7.493134, Planet Size (Earths): 2.76, Planet Mass (Earths): 13.2, Planet Temp (C): 377.85, Planet Density: 3.45, Orbit Shape: 0.0","Hey there, young space explorer! Meet TOI-1260 c, a super cool planet that's like a big brother to its star, TOI-1260. This giant world is about 2.76 times bigger than Earth and orbits its star in just 7.5 days, which means it gets really hot with surface temperatures reaching up to 378°C - that's even hotter than some volcanic eruptions!","¡Hola ahí, joven explorador del espacio! Conoce a TOI-1260 c, un planeta super divertido que es como un hermano mayor para su estrella, TOI-1260. Este mundo gigante es casi tres veces más grande que la Tierra y gira alrededor de su estrella en solo 7,5 días, lo que significa que se vuelve realmente caliente con temperaturas superficiales que pueden alcanzar hasta 378°C – ¡incluso más calientes que algunas erupciones volcánicas!","Bonjour, jeune explorateur de l'espace ! Découvrez TOI-1260 c, un planète vraiment cool qui est comme le grand frère de sa star, TOI-1260. Ce monde géant est environ 2,76 fois plus gros que la Terre et orbite autour de sa star en seulement 7,5 jours, ce qui signifie qu'il peut atteindre des températures de surface jusqu'à 378°C - c'est même encore plus chaud que certaines éruptions volcaniques !","Hallo daheim, junger Weltraum-Entdecker! Hier ist TOI-1260 c, ein superschöner Planet, der wie ein großer Bruder zu seiner Sonne TOI-1260 ist. Dieser Riese ist etwa 2,76 Mal so groß wie die Erde und umrundet seine Sonne innerhalb von nur 7,5 Tagen – was bedeutet, dass es dort unten äußerst heiß wird mit Oberflächentemperaturen bis zu 378°C - noch heißer als einige Vulkanausbrüche!","युवा अंतरिक्ष वैज्ञानिकों को नमस्ते, TOI-1260 c एक अद्भुत ग्रह है, जो अपने तारे TOI-1260 का बड़ा भाई है। यह विशाल दुनिया, पृथ्वी से लगभग 2.76 गुना बड़ा है और अपने तारे के चारों ओर बस 7.5 दिनों में घूमता है, जिससे इसका सطح बहुत गर्म हो जाता है और तापमान 378°C तक पहुंच जाता है, जो कुछ वुल्केनिक ब्लास्ट्स भी उससे गर्म होते हैं।","Hey there, young space explorer!

TOI-1260 c を紹介します。この星 TOI-1260 の「兄貴」と言える巨大な惑星です。TOI-1260 c は地球の約 2.76 倍大きく、7.5 日でその星を一周しています。そのため、表面温度は高く、378°C まで達します。これは、ある程度の火山噴出よりも熱いものです！"
Kepler-111 c,Kepler-111,1,2,224.77833,7.084,222.47988,3.42,0.176,0.5925707277597946,78.85000000000002,"Planet: Kepler-111 c, Star: Kepler-111, Star Count: 1, Planet Count: 2, Orbit Time (days): 224.77833, Planet Size (Earths): 7.084, Planet Mass (Earths): 222.47988, Planet Temp (C): 78.85000000000002, Planet Density: 3.42, Orbit Shape: 0.176","Here's an explanation of Kepler-111 c that a kid between 12 to 16 might enjoy:

Imagine a super-sized planet called Kepler-111 c that's about 7 times bigger than Earth! This giant planet orbits its star, Kepler-111, in a relatively slow circle, taking about 224 days to complete one lap. The surface temperature of this massive world is just right for life, with a warm climate similar to a cozy day on Earth, making it an interesting place to learn more about.","Imagina un planeta gigante llamado Kepler-111 c que es aproximadamente siete veces más grande que la Tierra! Este gigantesco planeta orbita alrededor de su estrella, Kepler-111, en un círculo relativamente lento, tardando unos 224 días en completar una vuelta. La temperatura superficial de este mundo masivo está justamente adecuada para la vida, con un clima cálido similar a un día acogedor en la Tierra, lo que lo hace un lugar interesante para aprender más sobre él.","Voici une explication de Kepler-111 c qui pourrait intéresser un jeune entre 12 et 16 ans :

Imaginez un gigantesque planète appelée Kepler-111 c, qui est environ 7 fois plus grande que la Terre ! Cette géante orbite autour de son étoile, Kepler-111, sur une trajectoire ronde relativement lente, accomplissant un tour en 224 jours. La température à sa surface est idéale pour la vie, avec un climat doux analogue à une journée confortable sur Terre, ce qui en fait un endroit intéressant où apprendre davantage.","Hier ist eine Erklärung von Kepler-111 c, die ein Kind zwischen 12 und 16 Jahren interessieren könnte:

Stell dir vor, ein riesiger Planet namens Kepler-111 c, der etwa siebenmal größer als die Erde ist! Der Riese dreht sich um seinen Stern, Kepler-111, in einem ziemlich langsamen Kreis, braucht also etwa 224 Tage, bis er eine volle Umdrehung gemacht hat. Die Oberflächentemperatur dieses massiven Welten liegt gerade recht für Leben, mit einer warmen Klimazone ähnlich wie einem gemütlichen Tag auf der Erde, also ist es ein interessantes Ziel, um mehr darüber zu erfahren.","केपलर-111 सी के बारे में एक बच्चे के लिए समझाना यह है:

एक अद्भुत आकार का ग्रह जिसे केपलर-111 सी कहा जाता है, जो भूमि से लगभग 7 गुना बड़ा है। यह विशाल ग्रह अपने तारे, केपलर-111 के चारों ओर एक मध्यम गति से परिक्रमा करता है और इसकी एक परिक्रमा पूरी करने में लगभग 224 दिन लगते हैं। इस महानलोक का सतही तापमान जीवन के लिए उपयुक्त है, इसका गर्म जलवायु भूमि के एक आरामदायक दिन की तरह है, जिससे यह जगह और अधिक सीखने योगी बन गई।",コプラー１１１のcは、地球の約７倍大きい超大型惑星です。この巨大な惑星は、星コプラー１１１をまるで２４２日かかり回りながら周回しています。表面温度は、地球の暖かい日の様相で、生命に適した環境を持っています。
TOI-1260 b,TOI-1260,1,3,3.127463,2.41,8.56,3.35,0.0,0.4903609883219302,597.85,"Planet: TOI-1260 b, Star: TOI-1260, Star Count: 1, Planet Count: 3, Orbit Time (days): 3.127463, Planet Size (Earths): 2.41, Planet Mass (Earths): 8.56, Planet Temp (C): 597.85, Planet Density: 3.35, Orbit Shape: 0.0","""Hey kid! Let me tell you about TOI-1260 b, a planet that's pretty cool. It orbits a star called TOI-1260, which is kind of like our sun, and it's really close to its star, which makes it super hot with temperatures reaching up to 597 degrees Celsius - that's way hotter than your oven at home!","¡Hola, chico! Te voy a contar sobre TOI-1260 b, un planeta que es bastante cool. Orbita una estrella llamada TOI-1260, que es como nuestra estrella solar, y está muy cerca de ella, lo que la hace muy calurosa con temperaturas que llegan hasta 597 grados Celsius - ¡eso es mucho más caliente que el horno de tu casa!","Coui kid ! Je vais te raconter à propos de TOI-1260 b, une planète qui est plutôt cool. Elle orbite autour d'une étoile appelée TOI-1260, qui ressemble un peu comme notre soleil, et elle est vraiment proche de son étoile, ce qui fait qu'elle est incroyablement chaude avec des températures atteignant jusqu'à 597 degrés Celsius - c'est beaucoup plus chaud que ton four à la maison !","Hallo, Junge! Hör mal, ich erzähl dir was von TOI-1260 b, einem Planeten, der ziemlich cool ist. Er umkreist einen Stern namens TOI-1260, der ein bisschen so ist wie unser Sonne, und er ist wirklich nahe an seinem Stern, was ihn super heiß macht - die Temperaturen können bis zu 597 Grad Celsius steigen, das ist viel heißer als deine Heißluftanlage zu Hause!","कलयुगी! तुम्हें बताता हूँ TOI-1260 b के बारे, जो एक बहुत ही खास ग्रह है। यह एक सितारा, TOI-1260, के चारों ओर घूमता है जो हमारे सूरज जैसा है, और इसके करीब होने के कारण यह बेहद गर्म होता है, तापमान 597 डिग्री सेल्सियस तक पहुँचता है - घर पर आपके ओवन से बहुत अधिक!","Hey kid! Let me tell you about TOI-1260 b, a planet that's pretty cool. It orbits a star called TOI-1260, which is kind of like our sun, and it's really close to its star, which makes it super hot with temperatures reaching up to 597 degrees Celsius - that's way hotter than your oven at home!

 Translation:
～あなたにTOI-1260 bのことを見せたい！このTOI-1260 bは、まるで私たちの太陽のように見える星に回っている。でも、その星から非常に近いところを動いているのでとても熱い。それだけではありません。温度は597度となり、これはあなたの家にあるオーブンの熱さよりもずっと高くて危険です！"
TOI-2136 b,TOI-2136,1,1,7.851928,2.19,6.37,3.34,0.0,0.5636628669282393,121.85000000000002,"Planet: TOI-2136 b, Star: TOI-2136, Star Count: 1, Planet Count: 1, Orbit Time (days): 7.851928, Planet Size (Earths): 2.19, Planet Mass (Earths): 6.37, Planet Temp (C): 121.85000000000002, Planet Density: 3.34, Orbit Shape: 0.0","Here's an explanation of TOI-2136 b that a kid between 12 to 16 might enjoy:

TOI-2136 b is a pretty cool planet! It's like Earth's bigger cousin, with a size about 2 times bigger than our own planet, and it's really massive too - it weighs around 6.5 times more than Earth! This big planet orbits its star in just over 7 days, which means it gets super hot, reaching temperatures of up to 122°C (252°F), making it a scorching world!","Aquí está una explicación de TOI-2136 b que un niño entre 12 y 16 años podría disfrutar:

TOI-2136 b es un planeta bastante emocionante! Es como el primo mayor de la Tierra, con un tamaño aproximadamente dos veces más grande que nuestro propio planeta, y es realmente masivo también - pesa alrededor de seis veces más que la Tierra! Este gran planeta gira en torno a su estrella en solo unos 7 días, lo que significa que se vuelve extremadamente caliente, alcanzando temperaturas de hasta 122°C (252°F), convirtiéndolo en un mundo abrasador!","Voici une planète tout à fait sympa ! Elle ressemble un peu à la Terre, mais en plus grande taille : deux fois plus grosse que notre planète et vraiment énorme, puisqu'elle pèse environ 6,5 fois plus que la Terre ! Cette grande planète orbite autour de sa star en moins d'une semaine, soit environ 7 jours. Cela signifie qu'il fait très chaud là-bas, avec des températures allant jusqu'à 122 °C (252°F), ce qui fait de cette planète un monde vraiment ardent !","Hier ist eine Erklärung von TOI-2136 b, die ein Junge oder Mädchen zwischen 12 und 16 Jahren vielleicht genießen wird:

TOI-2136 b ist ein ziemlich cooler Planet! Es ist wie der größere Cousin der Erde, mit einer Größe um 2 Mal größer als unsere eigene Welt und es ist auch wirklich massiv – es wiegt etwa 6,5 Mal mehr als die Erde! Diese große Welt kreist ihre Sonne in weniger als 7 Tagen, was bedeutet, dass sie super heiß wird, bis zu 122°C (252°F), also ist es eine glühende Welt!","टाय-2136 बी एक बहुत ही शानदार ग्रह है! यह पृथ्वी से दोगुना बड़ा और बहुत भारी है, जिसका वजन लगभग 6.5 गुना अधिक है। यह अपने तारे की परिक्रमा करीबन 7 दिनों में करता है, जिससे इसकी तापमान बहुत अधिक हो जाती है और लगभग 122 डिग्री सेल्सियस (252°F) तक पहुँच जाती है। यह एक चर्बीली दुनिया है!",TOI-2136 b はとてもおもしろい惑星だ！地球の大きい姉妹に似ている、ちょうど約2倍以上大きくて重さは地球の約6.5倍もあるものだ。この大きな惑星はあっという間に7日ぐらいで自らの恒星を一周しており、このような激しい運動ゆえ、最高の気温は122°C (252°F) になることで、酷い熱帯世界になっている。
TOI-2196 b,TOI-2196,1,1,1.1947268,3.51,26.0,3.31,0.0,0.4334518561962626,1586.85,"Planet: TOI-2196 b, Star: TOI-2196, Star Count: 1, Planet Count: 1, Orbit Time (days): 1.1947268, Planet Size (Earths): 3.51, Planet Mass (Earths): 26.0, Planet Temp (C): 1586.85, Planet Density: 3.31, Orbit Shape: 0.0","Here's an explanation of the planet TOI-2196 b that a kid between 12 to 16 can enjoy:

Meet TOI-2196 b, a super-hot world that orbits really close to its star! It's about 3 and a half times bigger than Earth, but be careful not to get too cozy - it's so hot there that the surface temperature is over 1,500°C (that's way hotter than your oven at home!). The good news is that this scorching world has a super-dense core, making it one of the most extreme planets in our solar system!","¡Conoce a TOI-2196 b, un mundo supercaloroso que gira muy cerca de su estrella! Mide unos 3 y medio veces más que la Tierra, pero no te sientas demasiado cómodo: allí hace más de 1.500°C (¡mucho más caliente que tu horno en casa!). La buena noticia es que este mundo infernal tiene un núcleo superdenso, lo que lo convierte en uno de los planetas más extremos de nuestro sistema solar!","Voici l'explication du planète TOI-2196 b que les jeunes de 12 à 16 ans peuvent apprécier :

Rencontrez TOI-2196 b, un monde incroyablement chaud qui tourne vraiment proche de sa étoile ! Il est environ 3 et demi fois plus gros que la Terre, mais soyez prudent – il fait tellement chaud là-bas que la température à la surface dépasse les 1 500 °C (c'est beaucoup plus chaud que votre four à la maison!). La bonne nouvelle c'est que ce monde enflammé a un noyau incroyablement dense, le rendant l'un des planètes les plus extrêmes de notre système solaire !","Hier ist eine Erklärung zum Planeten TOI-2196 b, die ein Jugendlicher zwischen 12 und 16 Jahren genießen kann:

Treten Sie TOI-2196 b, einer superheißen Welt gegenüber, die sehr nahe an ihrem Stern kreist! Es handelt sich um einen Ball von etwa 3,5 Mal der Größe der Erde, aber achten Sie nicht darauf, sich zu sehr auf's Kuschelige einzulassen – es ist dort so heiß, dass die Oberflächentemperatur über 1.500°C liegt (das ist viel heißer als Ihre Heißröhre zu Hause!). Das Gute ist jedoch, dass diese brennende Welt einen superdichten Kern hat, was sie zu einem der extremsten Planeten unseres Sonnensystems macht!","ये है पृथ्वी से 3 और आधा गुना बड़ा ग्रह टाइओ-2196 बी, जो अपने तारे के बहुत करीब घूमता है! वहां का तापमान घर में आपके ओवन से भी अधिक, 1500 डिग्री सेल्सियस से ऊपर होगा।","トイ-2196 bは、地球の約3.5倍大きな天体です。星からとても近く回っているため、表面温度は1,500°C以上となります（つまり、このような天体では家で使うオーブンよりもずっと熱い状態が続きます）。しかし、これだけ激しくもぐもぐする世界は、地球に比べると非常に重い核を持っています。"
LTT 3780 c,LTT 3780,2,2,12.252284,2.39,8.04,3.24,0.024,0.5542014828061548,85.85000000000002,"Planet: LTT 3780 c, Star: LTT 3780, Star Count: 2, Planet Count: 2, Orbit Time (days): 12.252284, Planet Size (Earths): 2.39, Planet Mass (Earths): 8.04, Planet Temp (C): 85.85000000000002, Planet Density: 3.24, Orbit Shape: 0.024","Meet LTT 3780 c, a pretty cool planet! It's about twice the size of Earth and orbits its star in just under 12 days, which is super speedy. This big world has a relatively calm temperature around 86°C (like a warm summer day on Earth), making it a potentially habitable place to explore!","Conoce a LTT 3780 c, un planeta bastante interesante. Mide alrededor del doble de diámetro que la Tierra y orbita su estrella en unos 12 días, lo cual es muy rápido. Este mundo grande tiene una temperatura relativamente calmada alrededor de los 86°C (como un día de verano soleado en la Tierra), lo que lo convierte en un lugar potencialmente habitable para explorar.","Rencontrez LTT 3780 c, une planète plutôt cool ! C'est environ deux fois plus grande que la Terre et orbite autour de sa étoile en à peine 12 jours, ce qui est vraiment rapide. Ce grand monde a une température relativement calme d'environ 86°C (comme un jour d'été chaud sur Terre), ce qui en fait un endroit potentiellement habitable à explorer !","Treten Sie LTT 3780 c kennen, einem wirklich coolen Planeten! Er ist etwa doppelt so groß wie die Erde und umrundet seine Sonne in gerade einmal unter 12 Tagen, das ist super schnell. Dieser große Globus hat eine relativ ruhige Temperatur von etwa 86°C (wie an einem warmen Sommerstag auf der Erde), was ihn zu einem potenziell bewohnbaren Ort zum Erkunden macht!","लेटी ३७८० सी, एक बहुत ही अच्छा ग्रह में मिलेंगे ! यह पृथ्वी के दोगुने आकार का और लगभग १२ दिनों में अपने तारे का परिभ्रमण करता है, जो बहुत जल्दी है . यह बड़ा संसार लगभग ८६ डिग्री सेल्सियस (जैसे पृथ्वी पर गर्मी का एक आम दिन ) का तापमान रखता है, जिससे इसे एक ग्रह में भी विचर सकने की सम्भावना बढ़ जाती है !",LTT 3780 c は、実はとても面白い惑星なんです！その大きさは地球の二倍ぐらいで、その星をまわるのに12日程しかかからないなんてとてもうれしい速度ですね。そう大きなこの世界では温度は、けっこう穏やかな86°Cぐらいでした。地球の夏の日のような日が続いているみたいな感じです。このような平和な世界探査の可能性が高いので、LTT 3780 c は実際に住める惑星かもしれません！
